{
	"$schema": "http://json-schema.org/draft-07/schema#",
	"title": "Pi Coding Agent Theme",
	"description": "Theme schema for Pi coding agent",
	"type": "object",
	"required": [
		"name",
		"colors"
	],
	"properties": {
		"$schema": {
			"type": "string",
			"description": "JSON schema reference"
		},
		"name": {
			"type": "string",
			"pattern": "^[^/]+$",
			"description": "Theme name. Must not contain '/' because it is reserved for automatic light/dark theme settings."
		},
		"vars": {
			"type": "object",
			"description": "Reusable color variables",
			"additionalProperties": {
				"oneOf": [
					{
						"type": "string",
						"description": "Hex color (#RRGGBB), variable reference, or empty string for terminal default"
					},
					{
						"type": "integer",
						"minimum": 0,
						"maximum": 255,
						"description": "256-color palette index (0-255)"
					}
				]
			}
		},
		"colors": {
			"type": "object",
			"description": "Theme color definitions (thinkingMax is optional and falls back to thinkingXhigh)",
			"required": [
				"accent",
				"border",
				"borderAccent",
				"borderMuted",
				"success",
				"error",
				"warning",
				"muted",
				"dim",
				"text",
				"thinkingText",
				"selectedBg",
				"userMessageBg",
				"userMessageText",
				"customMessageBg",
				"customMessageText",
				"customMessageLabel",
				"toolPendingBg",
				"toolSuccessBg",
				"toolErrorBg",
				"toolTitle",
				"toolOutput",
				"mdHeading",
				"mdLink",
				"mdLinkUrl",
				"mdCode",
				"mdCodeBlock",
				"mdCodeBlockBorder",
				"mdQuote",
				"mdQuoteBorder",
				"mdHr",
				"mdListBullet",
				"toolDiffAdded",
				"toolDiffRemoved",
				"toolDiffContext",
				"syntaxComment",
				"syntaxKeyword",
				"syntaxFunction",
				"syntaxVariable",
				"syntaxString",
				"syntaxNumber",
				"syntaxType",
				"syntaxOperator",
				"syntaxPunctuation",
				"thinkingOff",
				"thinkingMinimal",
				"thinkingLow",
				"thinkingMedium",
				"thinkingHigh",
				"thinkingXhigh",
				"bashMode"
			],
			"properties": {
				"accent": {
					"$ref": "#/$defs/colorValue",
					"description": "Primary accent color (logo, selected items, cursor)"
				},
				"border": {
					"$ref": "#/$defs/colorValue",
					"description": "Normal borders"
				},
				"borderAccent": {
					"$ref": "#/$defs/colorValue",
					"description": "Highlighted borders"
				},
				"borderMuted": {
					"$ref": "#/$defs/colorValue",
					"description": "Subtle borders"
				},
				"success": {
					"$ref": "#/$defs/colorValue",
					"description": "Success states"
				},
				"error": {
					"$ref": "#/$defs/colorValue",
					"description": "Error states"
				},
				"warning": {
					"$ref": "#/$defs/colorValue",
					"description": "Warning states"
				},
				"muted": {
					"$ref": "#/$defs/colorValue",
					"description": "Secondary/dimmed text"
				},
				"dim": {
					"$ref": "#/$defs/colorValue",
					"description": "Very dimmed text (more subtle than muted)"
				},
				"text": {
					"$ref": "#/$defs/colorValue",
					"description": "Default text color (usually empty string)"
				},
				"thinkingText": {
					"$ref": "#/$defs/colorValue",
					"description": "Thinking block text color"
				},
				"selectedBg": {
					"$ref": "#/$defs/colorValue",
					"description": "Selected item background"
				},
				"userMessageBg": {
					"$ref": "#/$defs/colorValue",
					"description": "User message background"
				},
				"userMessageText": {
					"$ref": "#/$defs/colorValue",
					"description": "User message text color"
				},
				"customMessageBg": {
					"$ref": "#/$defs/colorValue",
					"description": "Custom message background (hook-injected messages)"
				},
				"customMessageText": {
					"$ref": "#/$defs/colorValue",
					"description": "Custom message text color"
				},
				"customMessageLabel": {
					"$ref": "#/$defs/colorValue",
					"description": "Custom message type label color"
				},
				"toolPendingBg": {
					"$ref": "#/$defs/colorValue",
					"description": "Tool execution box (pending state)"
				},
				"toolSuccessBg": {
					"$ref": "#/$defs/colorValue",
					"description": "Tool execution box (success state)"
				},
				"toolErrorBg": {
					"$ref": "#/$defs/colorValue",
					"description": "Tool execution box (error state)"
				},
				"toolTitle": {
					"$ref": "#/$defs/colorValue",
					"description": "Tool execution box title color"
				},
				"toolOutput": {
					"$ref": "#/$defs/colorValue",
					"description": "Tool execution box output text color"
				},
				"mdHeading": {
					"$ref": "#/$defs/colorValue",
					"description": "Markdown heading text"
				},
				"mdLink": {
					"$ref": "#/$defs/colorValue",
					"description": "Markdown link text"
				},
				"mdLinkUrl": {
					"$ref": "#/$defs/colorValue",
					"description": "Markdown link URL"
				},
				"mdCode": {
					"$ref": "#/$defs/colorValue",
					"description": "Markdown inline code"
				},
				"mdCodeBlock": {
					"$ref": "#/$defs/colorValue",
					"description": "Markdown code block content"
				},
				"mdCodeBlockBorder": {
					"$ref": "#/$defs/colorValue",
					"description": "Markdown code block fences"
				},
				"mdQuote": {
					"$ref": "#/$defs/colorValue",
					"description": "Markdown blockquote text"
				},
				"mdQuoteBorder": {
					"$ref": "#/$defs/colorValue",
					"description": "Markdown blockquote border"
				},
				"mdHr": {
					"$ref": "#/$defs/colorValue",
					"description": "Markdown horizontal rule"
				},
				"mdListBullet": {
					"$ref": "#/$defs/colorValue",
					"description": "Markdown list bullets/numbers"
				},
				"toolDiffAdded": {
					"$ref": "#/$defs/colorValue",
					"description": "Added lines in tool diffs"
				},
				"toolDiffRemoved": {
					"$ref": "#/$defs/colorValue",
					"description": "Removed lines in tool diffs"
				},
				"toolDiffContext": {
					"$ref": "#/$defs/colorValue",
					"description": "Context lines in tool diffs"
				},
				"syntaxComment": {
					"$ref": "#/$defs/colorValue",
					"description": "Syntax highlighting: comments"
				},
				"syntaxKeyword": {
					"$ref": "#/$defs/colorValue",
					"description": "Syntax highlighting: keywords"
				},
				"syntaxFunction": {
					"$ref": "#/$defs/colorValue",
					"description": "Syntax highlighting: function names"
				},
				"syntaxVariable": {
					"$ref": "#/$defs/colorValue",
					"description": "Syntax highlighting: variable names"
				},
				"syntaxString": {
					"$ref": "#/$defs/colorValue",
					"description": "Syntax highlighting: string literals"
				},
				"syntaxNumber": {
					"$ref": "#/$defs/colorValue",
					"description": "Syntax highlighting: number literals"
				},
				"syntaxType": {
					"$ref": "#/$defs/colorValue",
					"description": "Syntax highlighting: type names"
				},
				"syntaxOperator": {
					"$ref": "#/$defs/colorValue",
					"description": "Syntax highlighting: operators"
				},
				"syntaxPunctuation": {
					"$ref": "#/$defs/colorValue",
					"description": "Syntax highlighting: punctuation"
				},
				"thinkingOff": {
					"$ref": "#/$defs/colorValue",
					"description": "Thinking level border: off"
				},
				"thinkingMinimal": {
					"$ref": "#/$defs/colorValue",
					"description": "Thinking level border: minimal"
				},
				"thinkingLow": {
					"$ref": "#/$defs/colorValue",
					"description": "Thinking level border: low"
				},
				"thinkingMedium": {
					"$ref": "#/$defs/colorValue",
					"description": "Thinking level border: medium"
				},
				"thinkingHigh": {
					"$ref": "#/$defs/colorValue",
					"description": "Thinking level border: high"
				},
				"thinkingXhigh": {
					"$ref": "#/$defs/colorValue",
					"description": "Thinking level border: xhigh"
				},
				"thinkingMax": {
					"$ref": "#/$defs/colorValue",
					"description": "Thinking level border: max (falls back to thinkingXhigh when omitted)"
				},
				"bashMode": {
					"$ref": "#/$defs/colorValue",
					"description": "Editor border color in bash mode"
				},
				"pythonMode": {
					"$ref": "#/$defs/colorValue",
					"description": "Python REPL mode border color"
				},
				"statusLineSep": {
					"$ref": "#/$defs/colorValue",
					"description": "Status line separator color"
				},
				"statusLineModel": {
					"$ref": "#/$defs/colorValue",
					"description": "Status line model label color"
				},
				"statusLinePath": {
					"$ref": "#/$defs/colorValue",
					"description": "Status line working directory path color"
				},
				"statusLineGitClean": {
					"$ref": "#/$defs/colorValue",
					"description": "Status line git clean color"
				},
				"statusLineGitDirty": {
					"$ref": "#/$defs/colorValue",
					"description": "Status line git dirty color"
				},
				"statusLineContext": {
					"$ref": "#/$defs/colorValue",
					"description": "Status line context usage color"
				},
				"statusLineSpend": {
					"$ref": "#/$defs/colorValue",
					"description": "Status line session spend color"
				},
				"statusLineStaged": {
					"$ref": "#/$defs/colorValue",
					"description": "Status line git staged changes color"
				},
				"statusLineDirty": {
					"$ref": "#/$defs/colorValue",
					"description": "Status line git dirty changes color"
				},
				"statusLineUntracked": {
					"$ref": "#/$defs/colorValue",
					"description": "Status line git untracked changes color"
				},
				"statusLineOutput": {
					"$ref": "#/$defs/colorValue",
					"description": "Status line tool output color"
				},
				"statusLineCost": {
					"$ref": "#/$defs/colorValue",
					"description": "Status line cost color"
				},
				"statusLineSubagents": {
					"$ref": "#/$defs/colorValue",
					"description": "Status line subagent indicator color"
				}
			},
			"additionalProperties": false
		},
		"export": {
			"type": "object",
			"description": "Optional colors for HTML export (defaults derived from userMessageBg if not specified)",
			"properties": {
				"pageBg": {
					"$ref": "#/$defs/colorValue",
					"description": "Page background color"
				},
				"cardBg": {
					"$ref": "#/$defs/colorValue",
					"description": "Card/container background color"
				},
				"infoBg": {
					"$ref": "#/$defs/colorValue",
					"description": "Info sections background (system prompt, notices)"
				}
			},
			"additionalProperties": false
		},
		"symbols": {
			"type": "object",
			"description": "Symbol preset and per-key overrides for TUI glyphs",
			"properties": {
				"preset": {
					"type": "string",
					"enum": [
						"unicode",
						"nerd",
						"ascii",
						"null"
					],
					"description": "Default symbol preset; null disables preset-driven defaults"
				},
				"overrides": {
					"type": "object",
					"description": "Per-symbol key overrides; see TUI symbol registry for valid keys",
					"additionalProperties": {
						"type": "string"
					}
				},
				"spinnerFrames": {
					"oneOf": [
						{
							"type": "array",
							"items": {
								"type": "string"
							},
							"description": "Flat frame list applied to both status and activity spinners"
						},
						{
							"type": "object",
							"properties": {
								"status": {
									"type": "array",
									"items": {
										"type": "string"
									},
									"description": "Frames for status/spinner (~12.5fps)"
								},
								"activity": {
									"type": "array",
									"items": {
										"type": "string"
									},
									"description": "Frames for activity spinner (~30fps)"
								}
							}
						}
					]
				}
			}
		},
		"boxRound": {
			"type": "object",
			"description": "Rounded box-drawing characters (\u256d\u256e\u2570\u256f \u2500 \u2502)",
			"properties": {
				"topLeft": {
					"type": "string",
					"description": "topLeft box-drawing character"
				},
				"topRight": {
					"type": "string",
					"description": "topRight box-drawing character"
				},
				"bottomLeft": {
					"type": "string",
					"description": "bottomLeft box-drawing character"
				},
				"bottomRight": {
					"type": "string",
					"description": "bottomRight box-drawing character"
				},
				"horizontal": {
					"type": "string",
					"description": "horizontal box-drawing character"
				},
				"vertical": {
					"type": "string",
					"description": "vertical box-drawing character"
				}
			}
		},
		"boxSharp": {
			"type": "object",
			"description": "Sharp box-drawing characters (\u250c\u2510\u2514\u2518 \u2500 \u2502 \u252c\u2534\u251c\u2524 \u253c) \u2014 used for tables and junctions",
			"properties": {
				"topLeft": {
					"type": "string",
					"description": "topLeft box-drawing character"
				},
				"topRight": {
					"type": "string",
					"description": "topRight box-drawing character"
				},
				"bottomLeft": {
					"type": "string",
					"description": "bottomLeft box-drawing character"
				},
				"bottomRight": {
					"type": "string",
					"description": "bottomRight box-drawing character"
				},
				"horizontal": {
					"type": "string",
					"description": "horizontal box-drawing character"
				},
				"vertical": {
					"type": "string",
					"description": "vertical box-drawing character"
				},
				"teeDown": {
					"type": "string",
					"description": "teeDown box-drawing character"
				},
				"teeUp": {
					"type": "string",
					"description": "teeUp box-drawing character"
				},
				"teeRight": {
					"type": "string",
					"description": "teeRight box-drawing character"
				},
				"teeLeft": {
					"type": "string",
					"description": "teeLeft box-drawing character"
				},
				"cross": {
					"type": "string",
					"description": "cross box-drawing character"
				}
			}
		}
	},
	"additionalProperties": false,
	"$defs": {
		"colorValue": {
			"oneOf": [
				{
					"type": "string",
					"description": "Hex color (#RRGGBB), variable reference, or empty string for terminal default"
				},
				{
					"type": "integer",
					"minimum": 0,
					"maximum": 255,
					"description": "256-color palette index (0-255)"
				}
			]
		}
	}
}
