{
	"$schema": "https://raw.githubusercontent.com/earendil-works/pi/main/packages/coding-agent/src/modes/interactive/theme/theme-schema.json",
	"name": "light",
	"vars": {
		"teal": "#5a8080",
		"blue": "#547da7",
		"green": "#588458",
		"red": "#aa5555",
		"yellow": "#9a7326",
		"text": "#1f2328",
		"mediumGray": "#6c6c6c",
		"dimGray": "#767676",
		"lightGray": "#b0b0b0",
		"selectedBg": "#d0d0e0",
		"userMsgBg": "#e8e8e8",
		"toolPendingBg": "#e8e8f0",
		"toolSuccessBg": "#e8f0e8",
		"toolErrorBg": "#f0e8e8",
		"customMsgBg": "#ede7f6"
	},
	"colors": {
		"accent": "teal",
		"border": "blue",
		"borderAccent": "teal",
		"borderMuted": "lightGray",
		"success": "green",
		"error": "red",
		"warning": "yellow",
		"muted": "mediumGray",
		"dim": "dimGray",
		"text": "text",
		"thinkingText": "mediumGray",
		"selectedBg": "selectedBg",
		"userMessageBg": "userMsgBg",
		"userMessageText": "text",
		"customMessageBg": "customMsgBg",
		"customMessageText": "text",
		"customMessageLabel": "#7e57c2",
		"toolPendingBg": "toolPendingBg",
		"toolSuccessBg": "toolSuccessBg",
		"toolErrorBg": "toolErrorBg",
		"toolTitle": "text",
		"toolOutput": "mediumGray",
		"mdHeading": "yellow",
		"mdLink": "blue",
		"mdLinkUrl": "dimGray",
		"mdCode": "teal",
		"mdCodeBlock": "green",
		"mdCodeBlockBorder": "mediumGray",
		"mdQuote": "mediumGray",
		"mdQuoteBorder": "mediumGray",
		"mdHr": "mediumGray",
		"mdListBullet": "green",
		"toolDiffAdded": "green",
		"toolDiffRemoved": "red",
		"toolDiffContext": "mediumGray",
		"syntaxComment": "#008000",
		"syntaxKeyword": "#0000FF",
		"syntaxFunction": "#795E26",
		"syntaxVariable": "#001080",
		"syntaxString": "#A31515",
		"syntaxNumber": "#098658",
		"syntaxType": "#267F99",
		"syntaxOperator": "#000000",
		"syntaxPunctuation": "#000000",
		"thinkingOff": "lightGray",
		"thinkingMinimal": "#767676",
		"thinkingLow": "blue",
		"thinkingMedium": "teal",
		"thinkingHigh": "#875f87",
		"thinkingXhigh": "#8b008b",
		"bashMode": "green",
		"pythonMode": "green",
		"statusLineSep": "lightGray",
		"statusLineModel": "teal",
		"statusLinePath": "text",
		"statusLineGitClean": "green",
		"statusLineGitDirty": "yellow",
		"statusLineContext": "mediumGray",
		"statusLineSpend": "teal",
		"statusLineStaged": "green",
		"statusLineDirty": "yellow",
		"statusLineUntracked": "mediumGray",
		"statusLineOutput": "mediumGray",
		"statusLineCost": "yellow",
		"statusLineSubagents": "teal"
	},
	"symbols": {
		"preset": "unicode",
		"spinnerFrames": {
			"status": [
				"\u25d0",
				"\u25d3",
				"\u25d1",
				"\u25d2"
			],
			"activity": [
				"\u28fe",
				"\u28fd",
				"\u28fb",
				"\u28bf",
				"\u287f",
				"\u28df",
				"\u28ef",
				"\u28f7"
			]
		}
	},
	"boxRound": {
		"topLeft": "\u256d",
		"topRight": "\u256e",
		"bottomLeft": "\u2570",
		"bottomRight": "\u256f",
		"horizontal": "\u2500",
		"vertical": "\u2502"
	},
	"boxSharp": {
		"topLeft": "\u250c",
		"topRight": "\u2510",
		"bottomLeft": "\u2514",
		"bottomRight": "\u2518",
		"horizontal": "\u2500",
		"vertical": "\u2502",
		"teeDown": "\u252c",
		"teeUp": "\u2534",
		"teeRight": "\u251c",
		"teeLeft": "\u2524",
		"cross": "\u253c"
	},
	"export": {
		"pageBg": "#f8f8f8",
		"cardBg": "#ffffff",
		"infoBg": "#fffae6"
	}
}
