{
	"$schema": "https://raw.githubusercontent.com/earendil-works/pi/main/packages/coding-agent/src/modes/interactive/theme/theme-schema.json",
	"name": "dark",
	"vars": {
		"cyan": "#00d7ff",
		"blue": "#5f87ff",
		"green": "#b5bd68",
		"red": "#cc6666",
		"yellow": "#ffff00",
		"text": "#d4d4d4",
		"gray": "#808080",
		"dimGray": "#666666",
		"darkGray": "#505050",
		"accent": "#8abeb7",
		"selectedBg": "#3a3a4a",
		"userMsgBg": "#343541",
		"toolPendingBg": "#282832",
		"toolSuccessBg": "#283228",
		"toolErrorBg": "#3c2828",
		"customMsgBg": "#2d2838"
	},
	"colors": {
		"accent": "accent",
		"border": "blue",
		"borderAccent": "cyan",
		"borderMuted": "darkGray",
		"success": "green",
		"error": "red",
		"warning": "yellow",
		"muted": "gray",
		"dim": "dimGray",
		"text": "text",
		"thinkingText": "gray",
		"selectedBg": "selectedBg",
		"userMessageBg": "userMsgBg",
		"userMessageText": "text",
		"customMessageBg": "customMsgBg",
		"customMessageText": "text",
		"customMessageLabel": "#9575cd",
		"toolPendingBg": "toolPendingBg",
		"toolSuccessBg": "toolSuccessBg",
		"toolErrorBg": "toolErrorBg",
		"toolTitle": "text",
		"toolOutput": "gray",
		"mdHeading": "#f0c674",
		"mdLink": "#81a2be",
		"mdLinkUrl": "dimGray",
		"mdCode": "accent",
		"mdCodeBlock": "green",
		"mdCodeBlockBorder": "gray",
		"mdQuote": "gray",
		"mdQuoteBorder": "gray",
		"mdHr": "gray",
		"mdListBullet": "accent",
		"toolDiffAdded": "green",
		"toolDiffRemoved": "red",
		"toolDiffContext": "gray",
		"syntaxComment": "#6A9955",
		"syntaxKeyword": "#569CD6",
		"syntaxFunction": "#DCDCAA",
		"syntaxVariable": "#9CDCFE",
		"syntaxString": "#CE9178",
		"syntaxNumber": "#B5CEA8",
		"syntaxType": "#4EC9B0",
		"syntaxOperator": "#D4D4D4",
		"syntaxPunctuation": "#D4D4D4",
		"thinkingOff": "darkGray",
		"thinkingMinimal": "#6e6e6e",
		"thinkingLow": "#5f87af",
		"thinkingMedium": "#81a2be",
		"thinkingHigh": "#b294bb",
		"thinkingXhigh": "#d183e8",
		"thinkingMax": "#ff5fff",
		"bashMode": "green",
		"pythonMode": "green",
		"statusLineSep": "darkGray",
		"statusLineModel": "accent",
		"statusLinePath": "text",
		"statusLineGitClean": "green",
		"statusLineGitDirty": "yellow",
		"statusLineContext": "gray",
		"statusLineSpend": "accent",
		"statusLineStaged": "green",
		"statusLineDirty": "yellow",
		"statusLineUntracked": "gray",
		"statusLineOutput": "gray",
		"statusLineCost": "yellow",
		"statusLineSubagents": "accent"
	},
	"symbols": {
		"preset": "unicode",
		"spinnerFrames": {
			"status": [
				"\u25d0",
				"\u25d3",
				"\u25d1",
				"\u25d2"
			],
			"activity": [
				"\u28fe",
				"\u28fd",
				"\u28fb",
				"\u28bf",
				"\u287f",
				"\u28df",
				"\u28ef",
				"\u28f7"
			]
		}
	},
	"boxRound": {
		"topLeft": "\u256d",
		"topRight": "\u256e",
		"bottomLeft": "\u2570",
		"bottomRight": "\u256f",
		"horizontal": "\u2500",
		"vertical": "\u2502"
	},
	"boxSharp": {
		"topLeft": "\u250c",
		"topRight": "\u2510",
		"bottomLeft": "\u2514",
		"bottomRight": "\u2518",
		"horizontal": "\u2500",
		"vertical": "\u2502",
		"teeDown": "\u252c",
		"teeUp": "\u2534",
		"teeRight": "\u251c",
		"teeLeft": "\u2524",
		"cross": "\u253c"
	},
	"export": {
		"pageBg": "#18181e",
		"cardBg": "#1e1e24",
		"infoBg": "#3c3728"
	}
}
