{
	"$schema": "https://raw.githubusercontent.com/earendil-works/pi/main/packages/coding-agent/src/modes/interactive/theme/theme-schema.json",
	"name": "vivid",
	"vars": {
		"cyan": "#22d3ee",
		"blue": "#82aaff",
		"green": "#4ade80",
		"red": "#f87171",
		"yellow": "#fbbf24",
		"text": "#e8e8f0",
		"gray": "#9aa0b4",
		"dimGray": "#6b7280",
		"darkGray": "#4b5163",
		"accent": "#22d3ee",
		"violet": "#a78bfa",
		"selectedBg": "#312e4f",
		"userMsgBg": "#2b2b3f",
		"toolPendingBg": "#26263a",
		"toolSuccessBg": "#20342a",
		"toolErrorBg": "#3d2530",
		"customMsgBg": "#2e2742"
	},
	"colors": {
		"accent": "accent",
		"border": "violet",
		"borderAccent": "cyan",
		"borderMuted": "darkGray",
		"success": "green",
		"error": "red",
		"warning": "yellow",
		"muted": "gray",
		"dim": "dimGray",
		"text": "text",
		"thinkingText": "gray",
		"selectedBg": "selectedBg",
		"userMessageBg": "userMsgBg",
		"userMessageText": "text",
		"customMessageBg": "customMsgBg",
		"customMessageText": "text",
		"customMessageLabel": "violet",
		"toolPendingBg": "toolPendingBg",
		"toolSuccessBg": "toolSuccessBg",
		"toolErrorBg": "toolErrorBg",
		"toolTitle": "cyan",
		"toolOutput": "text",
		"mdHeading": "#fbbf24",
		"mdLink": "cyan",
		"mdLinkUrl": "dimGray",
		"mdCode": "#f0abfc",
		"mdCodeBlock": "green",
		"mdCodeBlockBorder": "darkGray",
		"mdQuote": "gray",
		"mdQuoteBorder": "violet",
		"mdHr": "gray",
		"mdListBullet": "violet",
		"toolDiffAdded": "#4ade80",
		"toolDiffRemoved": "#f87171",
		"toolDiffContext": "gray",
		"syntaxComment": "#7c8294",
		"syntaxKeyword": "#c792ea",
		"syntaxFunction": "#82aaff",
		"syntaxVariable": "#e8e8f0",
		"syntaxString": "#c3e88d",
		"syntaxNumber": "#f78c6c",
		"syntaxType": "#ffcb6b",
		"syntaxOperator": "#89ddff",
		"syntaxPunctuation": "#9aa0b4",
		"thinkingOff": "darkGray",
		"thinkingMinimal": "#6e6e6e",
		"thinkingLow": "#4ade80",
		"thinkingMedium": "#fbbf24",
		"thinkingHigh": "#f78c6c",
		"thinkingXhigh": "#f87171",
		"bashMode": "green",
		"pythonMode": "green",
		"statusLineSep": "darkGray",
		"statusLineModel": "violet",
		"statusLinePath": "cyan",
		"statusLineGitClean": "green",
		"statusLineGitDirty": "yellow",
		"statusLineContext": "gray",
		"statusLineSpend": "accent",
		"statusLineStaged": "green",
		"statusLineDirty": "yellow",
		"statusLineUntracked": "gray",
		"statusLineOutput": "gray",
		"statusLineCost": "#f0abfc",
		"statusLineSubagents": "cyan"
	},
	"symbols": {
		"preset": "unicode",
		"spinnerFrames": {
			"status": [
				"\u25d0",
				"\u25d3",
				"\u25d1",
				"\u25d2"
			],
			"activity": [
				"\u28fe",
				"\u28fd",
				"\u28fb",
				"\u28bf",
				"\u287f",
				"\u28df",
				"\u28ef",
				"\u28f7"
			]
		}
	},
	"boxRound": {
		"topLeft": "\u256d",
		"topRight": "\u256e",
		"bottomLeft": "\u2570",
		"bottomRight": "\u256f",
		"horizontal": "\u2500",
		"vertical": "\u2502"
	},
	"boxSharp": {
		"topLeft": "\u250c",
		"topRight": "\u2510",
		"bottomLeft": "\u2514",
		"bottomRight": "\u2518",
		"horizontal": "\u2500",
		"vertical": "\u2502",
		"teeDown": "\u252c",
		"teeUp": "\u2534",
		"teeRight": "\u251c",
		"teeLeft": "\u2524",
		"cross": "\u253c"
	},
	"export": {
		"pageBg": "#16161f",
		"cardBg": "#1d1d29",
		"infoBg": "#2e2742"
	}
}
